{
  "schema_version": 2,
  "prompt_version": "check-verdict@2.0",
  "verdict": "GO_WITH_FIXES",
  "blocking_findings": [],
  "security_findings": [],
  "generated_at": "2026-05-14T00:00:00Z",
  "iteration": 2,
  "iteration_max": 3,
  "mode": "permissive",
  "mode_source": "frontmatter",
  "class_breakdown": {
    "architectural": 0,
    "security": 0,
    "contract": 4,
    "documentation": 5,
    "tests": 4,
    "scope-cuts": 1,
    "unclassified": 0
  },
  "class_inferred_count": 0,
  "followups_file": "docs/specs/uninstall-sh/followups.jsonl",
  "cap_reached": false,
  "stage": "check"
}